<?xml version="1.0" encoding="UTF-8" standalone="yes"?>
<configuration xmlns="http://config.por.eid" xmlns:xsi="http://www.w3.org/2001/XMLSchema-instance" xsi:schemaLocation="http://config.por.eid poreid.config.xsd">
    <poreid-supported-smartcards>
        <smartcard>
            <atr>3BFF9600008131FE4380318065B085040120120FFF829000D0</atr>
            <properties>
                <implementing-class>org.poreid.cc.gemsafe.GemsafeCard</implementing-class>
                <cache-enabled>true</cache-enabled>
            </properties>
        </smartcard>
        <smartcard>
            <atr>3BFF9600008131804380318065B0850300EF120FFF82900067</atr>
            <properties>
                <implementing-class>org.poreid.cc.gemsafe.GemsafeCard</implementing-class>
                <cache-enabled>true</cache-enabled>
            </properties>
        </smartcard>
        <smartcard>
            <atr>3B7D95000080318065B08311C0A98300</atr>
            <properties>
                <implementing-class>org.poreid.cc.gemsafe.GemsafeCard</implementing-class>
                <cache-enabled>true</cache-enabled>
            </properties>
        </smartcard>
        <smartcard>
            <atr>3B7D95000080318065B08311C0A983009000</atr>
            <properties>
                <implementing-class>org.poreid.cc.gemsafe.GemsafeCard</implementing-class>
                <cache-enabled>true</cache-enabled>
            </properties>
        </smartcard>
        <smartcard>
            <atr>3B7D95000080318065B0831100C88300</atr>
            <properties>
                <implementing-class>org.poreid.cc.gemsafe.GemsafeCard</implementing-class>
                <cache-enabled>true</cache-enabled>
            </properties>
        </smartcard>
        <smartcard>
            <atr>3B7D95000080318065B0831100C883009000</atr>
            <properties>
                <implementing-class>org.poreid.cc.gemsafe.GemsafeCard</implementing-class>
                <cache-enabled>true</cache-enabled>
            </properties>
        </smartcard>
        <smartcard>
            <atr>3B650000D000540131</atr>
            <properties>
                <implementing-class>org.poreid.cc.ias.IASCard</implementing-class>
                <cache-enabled>true</cache-enabled>
            </properties>
        </smartcard> 
        <smartcard>
            <atr>3B650000D000540132</atr>
            <properties>
                <implementing-class>org.poreid.cc.ias.IASCard</implementing-class>
                <cache-enabled>true</cache-enabled>
            </properties>
        </smartcard>  
        <smartcard>
            <atr>3B959540FFD000540131</atr>
            <properties>
                <implementing-class>org.poreid.cc.ias.IASCard</implementing-class>
                <cache-enabled>true</cache-enabled>
            </properties>
        </smartcard>  
        <smartcard>
            <atr>3B959540FFD000540132</atr>
            <properties>
                <implementing-class>org.poreid.cc.ias.IASCard</implementing-class>
                <cache-enabled>true</cache-enabled>
            </properties>
        </smartcard>
    </poreid-supported-smartcards>
    <smartcard-pinpad-readers>
        <aliases>
            <alias-of unique-id="IDBridgeCT700">
                <alias>Gemalto GemPC Pinpad USB Smart Card Read</alias>
                <alias>Gemalto USB GemPCPinpad SmartCard Reader</alias>
                <alias>Gemplus GemPC Pinpad</alias>
                <alias>Gemalto Ezio Shield</alias>                
            </alias-of>
            <alias-of unique-id="ACR83 PINeasy">
                <alias>ACS ACR83U</alias>
            </alias-of>
            <alias-of unique-id="XIRING MyLeo">
                <alias>XIRING MyLeo (123456789)</alias>
                <alias>XIRING USB Smart Card Reader</alias>
            </alias-of>
            <alias-of unique-id="generic reader">
                <alias>generic reader</alias>
            </alias-of>
        </aliases>
        <smartcard-readers>
            <smartcard-reader>
                <unique-id>ACR83 PINeasy</unique-id>
                <properties>
                    <implementing-class>org.poreid.pinpad.AcsACR83u</implementing-class>
                    <supported-oses>
                        <os>
                            <os-name>windows</os-name>
                            <supports>
                                <verify>true</verify>
                                <modify>true</modify>
                                <inject>true</inject>
                            </supports>
                        </os>
                        <os>
                            <os-name>linux</os-name>
                            <supports>
                                <verify>true</verify>
                                <modify>true</modify>
                                <inject>true</inject>
                            </supports>
                        </os>
                        <os>
                            <os-name>mac</os-name>
                            <supports>
                                <verify>false</verify>
                                <modify>false</modify>
                                <inject>true</inject>
                            </supports>
                        </os>
                    </supported-oses>
                    <supported-smartcards>
                        <smartcard>
                            <implementing-class>org.poreid.cc.gemsafe.GemsafeCard</implementing-class>
                            <properties>
                                <verify>true</verify>
                                <modify>false</modify>
                            </properties>
                        </smartcard>
                        <smartcard>
                            <implementing-class>org.poreid.cc.ias.IASCard</implementing-class>
                            <properties>
                                <verify>true</verify>
                                <modify>false</modify>
                            </properties>
                        </smartcard>
                    </supported-smartcards>
                </properties>
            </smartcard-reader>
            <smartcard-reader>
                <unique-id>IDBridgeCT700</unique-id>
                <properties>
                    <implementing-class>org.poreid.pinpad.GemaltoIDBridgeCT700</implementing-class>
                    <supported-oses>
                        <os>
                            <os-name>windows</os-name>
                            <supports>
                                <!-- estes senhores tÃªm um problema no driver em windows -->
                                <verify>true</verify>
                                <modify>true</modify>
                                <inject>true</inject>
                            </supports>
                        </os>
                        <os>
                            <os-name>linux</os-name>
                            <supports>
                                <verify>true</verify>
                                <modify>true</modify>
                                <inject>true</inject>
                            </supports>
                        </os>
                        <os>
                            <os-name>mac</os-name>
                            <supports>
                                <verify>true</verify>
                                <modify>true</modify>
                                <inject>true</inject>
                            </supports>
                        </os>
                    </supported-oses>
                    <supported-smartcards>
                        <smartcard>
                            <implementing-class>org.poreid.cc.gemsafe.GemsafeCard</implementing-class>
                            <properties>
                                <verify>true</verify>
                                <modify>true</modify>
                            </properties>
                        </smartcard>
                        <smartcard>
                            <implementing-class>org.poreid.cc.ias.IASCard</implementing-class>
                            <properties>
                                <verify>true</verify>
                                <modify>true</modify>
                            </properties>
                        </smartcard>
                    </supported-smartcards>
                </properties>
            </smartcard-reader>
            <smartcard-reader>
                <unique-id>XIRING MyLeo</unique-id>
                <properties>
                    <implementing-class>org.poreid.pinpad.XiringMyleo</implementing-class>
                    <supported-oses>
                        <os>
                            <os-name>windows</os-name>
                            <supports>
                                <verify>true</verify>
                                <modify>true</modify>
                                <inject>false</inject>
                            </supports>
                        </os>
                        <os>
                            <os-name>linux</os-name>
                            <supports>
                                <verify>true</verify>
                                <modify>true</modify>
                                <inject>true</inject>
                            </supports>
                        </os>
                        <os>
                            <os-name>mac</os-name>
                            <supports>
                                <verify>false</verify>
                                <modify>false</modify>
                                <inject>false</inject>
                            </supports>
                        </os>
                    </supported-oses>
                    <supported-smartcards>
                        <smartcard>